{
  "$schema": "https://json-schema.org/draft/2020-12/schema",
  "$id": "https://example.org/fwk-001/artifact.schema.json",
  "title": "FrameworkArtifactSidecar",
  "type": "object",
  "required": [
    "id",
    "version",
    "status",
    "framework",
    "kind",
    "createdAt",
    "updatedAt"
  ],
  "additionalProperties": true,
  "properties": {
    "id": { "type": "string", "pattern": "^[A-Za-z0-9_.-]+$" },
    "version": { "type": "string", "pattern": "^(0|[1-9]\\d*)\\.(0|[1-9]\\d*)\\.(0|[1-9]\\d*)(?:-[0-9A-Za-z-.]+)?(?:\\+[0-9A-Za-z-.]+)?$" },
    "status": { "type": "string", "enum": ["draft", "review", "approved", "deprecated"] },
    "framework": { "type": "string" },
    "kind": { "type": "string" },
    "labels": { "type": "array", "items": { "type": "string" } },
    "checksumSha256": { "type": "string", "pattern": "^[a-f0-9]{64}$" },
    "createdAt": { "type": "string", "pattern": "^\\d{4}-\\d{2}-\\d{2}T\\d{2}:\\d{2}:\\d{2}Z$" },
    "updatedAt": { "type": "string", "pattern": "^\\d{4}-\\d{2}-\\d{2}T\\d{2}:\\d{2}:\\d{2}Z$" }
  }
}


